{
  "channel": "latest",
  "generated_at": "2026-06-29T02:15:45+00:00",
  "git_commit": "0000000000000000000000000000000000000000",
  "packages": {
    "logion-cli": {
      "minimum_client": "0.1.2",
      "minimum_python": "3.12",
      "npm_name": "@logionsh/cli",
      "pypi_name": "logion-cli",
      "tag": "logion-cli-v0.1.9",
      "version": "0.1.9",
      "wheel": {
        "sha256": "1c4f3a5f9a8f753ce4e9ec8f4df193dda3e97e959eecd86983ea18303ef06071",
        "url": "release://logion_cli-0.1.9-py3-none-any.whl"
      }
    },
    "logion-client": {
      "minimum_python": "3.12",
      "pypi_name": "logion-client",
      "tag": "logion-client-v0.1.4",
      "version": "0.1.4",
      "wheel": {
        "sha256": "8c2425233175de1f425935e8afcbbfff21a55c5dc57f1e84ad79131c9d79f7fd",
        "url": "release://logion_client-0.1.4-py3-none-any.whl"
      }
    },
    "logion-companion": {
      "bundle": {
        "sha256": "a0d56d99f52d4f93351ebeb50499c812fd15053924f5134732302aa461e29c17",
        "url": "release://logion-marketplace-companion-0.1.6.tar.gz"
      },
      "minimum_cli": "0.1.2",
      "minimum_python": "3.12",
      "tag": "logion-companion-v0.1.6",
      "version": "0.1.6"
    }
  },
  "schema_version": 1
}
