{
  "channel": "stable",
  "generated_at": "2026-06-28T19:17:20+00:00",
  "git_commit": "0000000000000000000000000000000000000000",
  "packages": {
    "logion-cli": {
      "minimum_client": "0.1.2",
      "minimum_python": "3.12",
      "npm_name": "@logionsh/cli",
      "pypi_name": "logion-cli",
      "tag": "logion-cli-v0.1.2",
      "version": "0.1.2"
    },
    "logion-client": {
      "minimum_python": "3.12",
      "pypi_name": "logion-client",
      "tag": "logion-client-v0.1.2",
      "version": "0.1.2"
    },
    "logion-companion": {
      "minimum_cli": "0.1.2",
      "minimum_python": "3.12",
      "tag": "logion-companion-v0.1.2",
      "version": "0.1.2"
    }
  },
  "schema_version": 1
}
